{
  "ingestion_schema": "lt-crime-monitor/1.0",
  "event_key": "lamezia-rapina-ufficio-postale-via-aldo-moro-2018-04-21",
  "discovered_at": "2026-09-24T05:03:58+02:00",
  "updated_at": "2026-09-24T05:03:58+02:00",
  "record_status": "verified_source",
  "event_form": "discrete",
  "title": "Rapina all'ufficio postale di Via Aldo Moro a Lamezia Terme il 21 aprile 2018",
  "temporal": {
    "start": "2018-04-21",
    "end": "2018-04-21",
    "edtf": "2018-04-21",
    "precision": "exact_date"
  },
  "sources": [
    {
      "source_key": "press:lametino:2019-02-20:cenerentola-via-aldo-moro",
      "source_type": "press_secondary",
      "provider": "Il Lametino",
      "title": "Lamezia, operazione 'Cenerentola': fatta luce su rapine e furti in uffici postali ed esercizi commerciali: 11 arresti - NOMI E VIDEO",
      "url": "https://www.lametino.it/Cronaca/lamezia-furti-e-rapine-in-uffici-postali-ed-esercizi-commerciali-11-arresti.html",
      "published_at": "2019-02-20T07:18:00+01:00",
      "retrieved_at": "2026-09-24T05:03:58+02:00",
      "support_roles": [
        "event_support",
        "classification_support",
        "location_support",
        "procedural_context",
        "corroboration"
      ]
    },
    {
      "source_key": "press:corriere-calabria:2019-02-20:cenerentola-via-aldo-moro",
      "source_type": "press_secondary",
      "provider": "Corriere della Calabria",
      "title": "\"Cenerentola\" incastra la banda delle rapine agli uffici postali",
      "url": "https://www.corrieredellacalabria.it/2019/02/20/cenerentola-incastra-la-banda-delle-rapine-agli-uffici-postali/",
      "published_at": "2019-02-20T13:40:00+01:00",
      "retrieved_at": "2026-09-24T05:03:58+02:00",
      "support_roles": [
        "event_support",
        "classification_support",
        "location_support",
        "procedural_context",
        "corroboration"
      ]
    }
  ],
  "offences": [
    {
      "offence_key": "offence:rapina",
      "classification_source_key": "press:lametino:2019-02-20:cenerentola-via-aldo-moro",
      "classification_basis": "source_stated_legal",
      "iccs_code": null,
      "istat_catalogue_id": null,
      "istat_synthetic_code": null,
      "istat_analytical_code": null,
      "legal_reference": null,
      "attempt_status": "completed",
      "situational_context": [
        "Le ricostruzioni investigative pubblicate il 20 febbraio 2019 indicano che il 21 aprile 2018 fu consumata una rapina ai danni dell'ufficio postale di Via Aldo Moro a Lamezia Terme.",
        "L'operazione Cenerentola, sviluppata dai Carabinieri del Gruppo di Lamezia Terme e dalla Procura della Repubblica presso il Tribunale di Lamezia Terme, ricondusse cautelarmente il fatto a un gruppo di indagati sulla base, tra l'altro, di videosorveglianza, traffico telefonico e geolocalizzazione dei dispositivi.",
        "Le fonti consultate non vengono utilizzate per rappresentare una responsabilità definitivamente accertata; il record conserva il livello probatorio della fase cautelare descritto nel 2019.",
        "Le cronache disponibili non sono pienamente coerenti sull'importo sottratto; il record non normalizza quindi il valore del bottino."
      ],
      "cyber_related": null,
      "affected_object_count": null
    }
  ],
  "locations": [
    {
      "location_key": "location:lamezia-terme:ufficio-postale-via-aldo-moro:occurrence",
      "basis_source_key": "press:lametino:2019-02-20:cenerentola-via-aldo-moro",
      "role": "occurrence",
      "municipality": "Lamezia Terme",
      "evidence_basis": "source_stated_named_site",
      "evidence_precision": "exact_public_site",
      "resolved_precision": "exact_public_site",
      "sensitivity": "public_place",
      "publication_risk": "low_public_site",
      "geometry": null,
      "place_name": "Ufficio postale di Via Aldo Moro, Lamezia Terme",
      "neighbourhood": null,
      "iccs_location_type": null
    },
    {
      "location_key": "location:lamezia-terme:ufficio-postale-via-aldo-moro:target",
      "basis_source_key": "press:lametino:2019-02-20:cenerentola-via-aldo-moro",
      "role": "target",
      "municipality": "Lamezia Terme",
      "evidence_basis": "source_stated_named_site",
      "evidence_precision": "exact_public_site",
      "resolved_precision": "exact_public_site",
      "sensitivity": "public_place",
      "publication_risk": "victim_linked",
      "geometry": null,
      "place_name": "Ufficio postale di Via Aldo Moro, Lamezia Terme",
      "neighbourhood": null,
      "iccs_location_type": null
    }
  ]
}
