{
  "ingestion_schema": "lt-crime-monitor/1.0",
  "event_key": "lamezia-detenzione-hashish-corso-nicotera-2025-01-24",
  "discovered_at": "2026-09-21T11:05:34+02:00",
  "updated_at": "2026-09-21T11:05:34+02:00",
  "record_status": "verified_source",
  "event_form": "discrete",
  "title": "Detenzione di oltre 500 grammi di hashish in Corso Nicotera il 24 gennaio 2025",
  "temporal": {
    "start": "2025-01-24",
    "end": "2025-01-24",
    "edtf": "2025-01-24",
    "precision": "exact_date"
  },
  "sources": [
    {
      "source_key": "press:il-lametino:2025-01-29:hashish-corso-nicotera",
      "source_type": "press_secondary",
      "provider": "il Lametino",
      "title": "Lamezia, la Polizia ferma giovane con oltre mezzo chilo di hashish nascosto negli slip",
      "url": "https://www.lametino.it/cronaca/lamezia-la-polizia-ferma-giovane-con-oltre-mezzo-chilo-di-hashish-nascosto-negli-slip.html",
      "published_at": "2025-01-29T00:00:00+01:00",
      "retrieved_at": "2026-09-21T11:05:34+02:00",
      "support_roles": [
        "event_support",
        "classification_support",
        "location_support",
        "procedural_context"
      ]
    },
    {
      "source_key": "press:calabria-inchieste:2025-01-29:hashish-corso-nicotera",
      "source_type": "press_secondary",
      "provider": "Calabria Inchieste",
      "title": "Camminava su corso Nicotera con 500 grammi di hashish nascosta nella biancheria intima, arrestato 23enne",
      "url": "https://www.calabriainchieste.it/2025/01/29/camminava-su-corso-nicotera-con-500-grammi-di-hashish-nascosta-nella-biancheria-intima-arrestato-23enne",
      "published_at": "2025-01-29T00:00:00+01:00",
      "retrieved_at": "2026-09-21T11:05:34+02:00",
      "support_roles": [
        "event_support",
        "classification_support",
        "location_support",
        "procedural_context",
        "corroboration"
      ]
    }
  ],
  "offences": [
    {
      "offence_key": "offence:detenzione-stupefacenti-ai-fini-di-spaccio",
      "classification_source_key": "press:il-lametino:2025-01-29:hashish-corso-nicotera",
      "classification_basis": "provisional",
      "iccs_code": null,
      "istat_catalogue_id": null,
      "istat_synthetic_code": null,
      "istat_analytical_code": null,
      "legal_reference": null,
      "attempt_status": "completed",
      "situational_context": [
        "Nel pomeriggio del 24 gennaio 2025 una Volante del Commissariato di Lamezia Terme notò due giovani appiedati mentre transitava lungo Corso Nicotera e procedette al controllo.",
        "Durante la perquisizione personale furono rinvenuti cinque panetti di hashish per un peso complessivo superiore a 500 grammi, occultati nella biancheria intima, oltre a circa 800 euro in contanti.",
        "La persona controllata fu arrestata in flagranza; le fonti riferiscono successivamente l'applicazione dell'obbligo di presentazione quotidiana al Commissariato.",
        "La classificazione è mantenuta provvisoria perché in questa acquisizione non è stato recuperato il comunicato originario della Polizia di Stato o un provvedimento giudiziario che consenta una qualificazione tassonomica più forte."
      ],
      "cyber_related": null,
      "affected_object_count": null
    }
  ],
  "locations": [
    {
      "location_key": "location:corso-nicotera:occurrence",
      "basis_source_key": "press:il-lametino:2025-01-29:hashish-corso-nicotera",
      "role": "occurrence",
      "municipality": "Lamezia Terme",
      "evidence_basis": "source_stated_street",
      "evidence_precision": "street_segment",
      "resolved_precision": "street_segment",
      "sensitivity": "public_place",
      "publication_risk": "low_public_site",
      "geometry": null,
      "place_name": "Corso Nicotera",
      "neighbourhood": null,
      "iccs_location_type": null
    },
    {
      "location_key": "location:corso-nicotera:search",
      "basis_source_key": "press:il-lametino:2025-01-29:hashish-corso-nicotera",
      "role": "search",
      "municipality": "Lamezia Terme",
      "evidence_basis": "source_stated_street",
      "evidence_precision": "street_segment",
      "resolved_precision": "street_segment",
      "sensitivity": "public_place",
      "publication_risk": "low_public_site",
      "geometry": null,
      "place_name": "Corso Nicotera",
      "neighbourhood": null,
      "iccs_location_type": null
    },
    {
      "location_key": "location:corso-nicotera:recovery",
      "basis_source_key": "press:il-lametino:2025-01-29:hashish-corso-nicotera",
      "role": "recovery",
      "municipality": "Lamezia Terme",
      "evidence_basis": "source_stated_street",
      "evidence_precision": "street_segment",
      "resolved_precision": "street_segment",
      "sensitivity": "public_place",
      "publication_risk": "low_public_site",
      "geometry": null,
      "place_name": "Corso Nicotera",
      "neighbourhood": null,
      "iccs_location_type": null
    }
  ]
}
