{
  "ingestion_schema": "lt-crime-monitor/1.0",
  "event_key": "lamezia-detenzione-spaccio-zona-piazza-mercato-vecchio-2025-02",
  "discovered_at": "2026-09-08T18:06:09+02:00",
  "updated_at": "2026-09-08T18:06:09+02:00",
  "record_status": "verified_source",
  "event_form": "discrete",
  "title": "Detenzione ai fini di spaccio nella zona di Piazza Mercato Vecchio",
  "temporal": {
    "start": null,
    "end": null,
    "edtf": null,
    "precision": "week_or_similar"
  },
  "sources": [
    {
      "source_key": "press:corriere-di-lamezia:2025-02-24:controlli-carabinieri-piazza-mercato-vecchio",
      "source_type": "press_secondary",
      "provider": "Corriere di Lamezia",
      "title": "Lamezia, un arresto e 4 denunciati nell’ambito dell’operazione dei Carabinieri nelle piazze della ‘movida’ lametina",
      "url": "https://www.corrieredilamezia.it/cronaca/2025_02_24/lamezia-un-arresto-e-4-denunciati-nellambito-delloperazione-dei-carabinieri-nelle-piazze-della-movida-lametina_51294/",
      "published_at": null,
      "retrieved_at": "2026-09-08T18:06:09+02:00",
      "support_roles": [
        "event_support",
        "classification_support",
        "location_support",
        "procedural_context"
      ]
    },
    {
      "source_key": "press:corriere-della-calabria:2025-02-24:arresto-droga-piazza-mercato-vecchio",
      "source_type": "press_secondary",
      "provider": "Corriere della Calabria",
      "title": "Lamezia Terme, un arresto per droga. Allarme giovani, anche un minorenne nelle attività di spaccio",
      "url": "https://www.corrieredellacalabria.it/2025/02/24/lamezia-terme-un-arresto-per-droga-allarme-giovani-anche-un-minorenne-nelle-attivita-di-spaccio/",
      "published_at": null,
      "retrieved_at": "2026-09-08T18:06:09+02:00",
      "support_roles": [
        "event_support",
        "classification_support",
        "location_support",
        "procedural_context",
        "corroboration"
      ]
    },
    {
      "source_key": "press:pillamaro:2025-02-24:alto-impatto-piazza-mercato-vecchio",
      "source_type": "press_secondary",
      "provider": "PillaMaro.it",
      "title": "Operazione interforze ‘Alto impatto’ a Lamezia Terme: un arresto e 4 denunce",
      "url": "https://www.pillamaro.it/cronaca/operazione-interforze-alto-impatto-a-lamezia-terme-un-arresto-e-4-denunce",
      "published_at": null,
      "retrieved_at": "2026-09-08T18:06:09+02:00",
      "support_roles": [
        "event_support",
        "classification_support",
        "location_support",
        "procedural_context",
        "corroboration"
      ]
    }
  ],
  "offences": [
    {
      "offence_key": "offence:detenzione-ai-fini-di-spaccio-stupefacenti",
      "classification_source_key": "press:corriere-di-lamezia:2025-02-24:controlli-carabinieri-piazza-mercato-vecchio",
      "classification_basis": "source_stated_legal",
      "iccs_code": null,
      "istat_catalogue_id": null,
      "istat_synthetic_code": null,
      "istat_analytical_code": null,
      "legal_reference": null,
      "attempt_status": "completed",
      "situational_context": [
        "le fonti riferiscono un arresto per detenzione ai fini di spaccio nella zona di Piazza Mercato Vecchio durante i controlli dei Carabinieri del fine settimana",
        "la persona arrestata fu sorpresa in possesso di 41 grammi di hashish suddiviso in dosi, un bilancino di precisione e oltre 500 euro in contanti ritenuti provento dell’attività di spaccio",
        "le fonti riferiscono che l’arresto fu successivamente convalidato dal GIP presso il Tribunale di Lamezia Terme su richiesta della locale Procura della Repubblica; il record non rappresenta un accertamento definitivo di responsabilità"
      ],
      "cyber_related": null,
      "affected_object_count": null
    }
  ],
  "locations": [
    {
      "location_key": "location:lamezia-terme:zona-piazza-mercato-vecchio:occurrence",
      "basis_source_key": "press:corriere-di-lamezia:2025-02-24:controlli-carabinieri-piazza-mercato-vecchio",
      "role": "occurrence",
      "municipality": "Lamezia Terme",
      "evidence_basis": "source_stated_locality",
      "evidence_precision": "locality",
      "resolved_precision": "locality",
      "sensitivity": "public_place",
      "publication_risk": "low_public_site",
      "geometry": null,
      "place_name": "Zona di Piazza Mercato Vecchio",
      "neighbourhood": "Nicastro",
      "iccs_location_type": null
    },
    {
      "location_key": "location:lamezia-terme:zona-piazza-mercato-vecchio:arrest",
      "basis_source_key": "press:corriere-di-lamezia:2025-02-24:controlli-carabinieri-piazza-mercato-vecchio",
      "role": "arrest",
      "municipality": "Lamezia Terme",
      "evidence_basis": "source_stated_locality",
      "evidence_precision": "locality",
      "resolved_precision": "locality",
      "sensitivity": "public_place",
      "publication_risk": "low_public_site",
      "geometry": null,
      "place_name": "Zona di Piazza Mercato Vecchio",
      "neighbourhood": "Nicastro",
      "iccs_location_type": null
    },
    {
      "location_key": "location:lamezia-terme:zona-piazza-mercato-vecchio:recovery",
      "basis_source_key": "press:corriere-di-lamezia:2025-02-24:controlli-carabinieri-piazza-mercato-vecchio",
      "role": "recovery",
      "municipality": "Lamezia Terme",
      "evidence_basis": "source_stated_locality",
      "evidence_precision": "locality",
      "resolved_precision": "locality",
      "sensitivity": "public_place",
      "publication_risk": "low_public_site",
      "geometry": null,
      "place_name": "Zona di Piazza Mercato Vecchio",
      "neighbourhood": "Nicastro",
      "iccs_location_type": null
    }
  ]
}
