{
  "ingestion_schema": "lt-crime-monitor/1.0",
  "event_key": "lamezia-vandalizzazione-sede-segreteria-elettorale-2010-03-15",
  "discovered_at": "2026-09-18T20:44:58+02:00",
  "updated_at": "2026-09-18T20:44:58+02:00",
  "record_status": "verified_source",
  "event_form": "discrete",
  "title": "Vandalizzazione di una sede di segreteria elettorale a Lamezia Terme il 15 marzo 2010",
  "temporal": {
    "start": "2010-03-15",
    "end": "2010-03-15",
    "edtf": "2010-03-15",
    "precision": "exact_date"
  },
  "sources": [
    {
      "source_key": "other:avviso-pubblico:2011:amministratori-sotto-tiro",
      "source_type": "other",
      "provider": "Avviso Pubblico",
      "title": "Amministratori sotto tiro. Minacce e intimidazioni mafiose e criminali agli amministratori locali e al personale della Pubblica Amministrazione",
      "url": "https://www.itaca.org/documenti/news/Rapporto_mafie_Avviso_Pubblico_dic2011.pdf",
      "published_at": null,
      "retrieved_at": "2026-09-18T20:44:58+02:00",
      "support_roles": [
        "event_support",
        "classification_support",
        "location_support"
      ]
    },
    {
      "source_key": "press:repubblica:2011-12-02:cosi-mafia-minaccia-amministratori-locali",
      "source_type": "press_secondary",
      "provider": "la Repubblica",
      "title": "Così la mafia minaccia gli amministratori locali",
      "url": "https://www.repubblica.it/cronaca/2011/12/02/news/criminalit-25956101/",
      "published_at": null,
      "retrieved_at": "2026-09-18T20:44:58+02:00",
      "support_roles": [
        "event_support",
        "classification_support",
        "location_support",
        "corroboration"
      ]
    }
  ],
  "offences": [
    {
      "offence_key": "offence:atto-vandalico",
      "classification_source_key": "other:avviso-pubblico:2011:amministratori-sotto-tiro",
      "classification_basis": "provisional",
      "iccs_code": null,
      "istat_catalogue_id": null,
      "istat_synthetic_code": null,
      "istat_analytical_code": null,
      "legal_reference": null,
      "attempt_status": "completed",
      "situational_context": [
        "Il rapporto di Avviso Pubblico colloca l'episodio a Lamezia Terme il 15 marzo 2010 e riferisce che sconosciuti entrarono nella sede della segreteria elettorale di una candidata a sindaco, mettendo a soqquadro il locale e provocando molti danni.",
        "La qualificazione resta provvisoria: la fonte definisce il fatto un atto vandalico, ma non è stata recuperata una fonte giudiziaria o di polizia che sostenga una specifica fattispecie penale o una matrice criminale più precisa."
      ],
      "cyber_related": null,
      "affected_object_count": null
    }
  ],
  "locations": [
    {
      "location_key": "location:lamezia-terme:sede-segreteria-elettorale-non-identificata:occurrence",
      "basis_source_key": "other:avviso-pubblico:2011:amministratori-sotto-tiro",
      "role": "occurrence",
      "municipality": "Lamezia Terme",
      "evidence_basis": "unknown",
      "evidence_precision": "municipality",
      "resolved_precision": "municipality",
      "sensitivity": "public_place",
      "publication_risk": "low_public_site",
      "geometry": null,
      "place_name": "Sede di segreteria elettorale non identificata a Lamezia Terme",
      "neighbourhood": null,
      "iccs_location_type": null
    },
    {
      "location_key": "location:lamezia-terme:sede-segreteria-elettorale-non-identificata:target",
      "basis_source_key": "other:avviso-pubblico:2011:amministratori-sotto-tiro",
      "role": "target",
      "municipality": "Lamezia Terme",
      "evidence_basis": "unknown",
      "evidence_precision": "municipality",
      "resolved_precision": "municipality",
      "sensitivity": "public_place",
      "publication_risk": "victim_linked",
      "geometry": null,
      "place_name": "Sede di segreteria elettorale non identificata a Lamezia Terme",
      "neighbourhood": null,
      "iccs_location_type": null
    }
  ]
}
