{
  "ingestion_schema": "lt-crime-monitor/1.0",
  "event_key": "lamezia-falsa-bomba-via-del-soccorso-2015-10-28",
  "discovered_at": "2026-09-19T19:53:30+02:00",
  "updated_at": "2026-09-19T19:53:30+02:00",
  "record_status": "verified_source",
  "event_form": "discrete",
  "title": "Falsa bomba rinvenuta presso una proprietà disabitata in via del Soccorso il 28 ottobre 2015",
  "temporal": {
    "start": "2015-10-28",
    "end": "2015-10-28",
    "edtf": "2015-10-28",
    "precision": "exact_date"
  },
  "sources": [
    {
      "source_key": "press:lametino:2015-10-28:falsa-bomba-via-del-soccorso",
      "source_type": "press_secondary",
      "provider": "il Lametino",
      "title": "Lamezia: falsa bomba davanti proprietà, si segue pista intimidazione",
      "url": "https://www.lametino.it/cronaca/lamezia-falsa-bomba-davanti-proprieta-si-segue-pista-intimidazione.html",
      "published_at": "2015-10-28",
      "retrieved_at": "2026-09-19T19:53:30+02:00",
      "support_roles": [
        "event_support",
        "classification_support",
        "location_support",
        "procedural_context"
      ]
    }
  ],
  "offences": [
    {
      "offence_key": "offence:intimidazione",
      "classification_source_key": "press:lametino:2015-10-28:falsa-bomba-via-del-soccorso",
      "classification_basis": "provisional",
      "iccs_code": null,
      "istat_catalogue_id": null,
      "istat_synthetic_code": null,
      "istat_analytical_code": null,
      "legal_reference": null,
      "attempt_status": "completed",
      "situational_context": [
        "la fonte contemporanea descrive il rinvenimento come una 'strana intimidazione' scoperta nella mattinata del 28 ottobre 2015 da Polizia di Stato e Carabinieri in via del Soccorso",
        "vicino al cancello di una proprietà disabitata fu rinvenuta una bottiglia di birra avvolta in carta di giornale dalla quale fuoriuscivano una miccia e un filo elettrico",
        "un robot in dotazione alla Polizia accertò che la bottiglia non era in realtà una vera bomba; non è stata reperita in questa ricerca una fonte primaria o giudiziaria che sostenga una qualificazione penale più specifica"
      ],
      "cyber_related": null,
      "affected_object_count": 1
    }
  ],
  "locations": [
    {
      "location_key": "location:lamezia-terme:via-del-soccorso:proprieta-disabitata:occurrence",
      "basis_source_key": "press:lametino:2015-10-28:falsa-bomba-via-del-soccorso",
      "role": "occurrence",
      "municipality": "Lamezia Terme",
      "evidence_basis": "source_stated_street",
      "evidence_precision": "street_segment",
      "resolved_precision": "street_segment",
      "sensitivity": "private_or_sensitive",
      "publication_risk": "residential",
      "geometry": null,
      "place_name": "Vicino al cancello di una proprietà disabitata in via del Soccorso, nei pressi del centro storico",
      "neighbourhood": null,
      "iccs_location_type": null
    },
    {
      "location_key": "location:lamezia-terme:via-del-soccorso:proprieta-disabitata:target",
      "basis_source_key": "press:lametino:2015-10-28:falsa-bomba-via-del-soccorso",
      "role": "target",
      "municipality": "Lamezia Terme",
      "evidence_basis": "source_stated_street",
      "evidence_precision": "street_segment",
      "resolved_precision": "street_segment",
      "sensitivity": "private_or_sensitive",
      "publication_risk": "residential",
      "geometry": null,
      "place_name": "Proprietà disabitata in via del Soccorso, nei pressi del centro storico",
      "neighbourhood": null,
      "iccs_location_type": null
    },
    {
      "location_key": "location:lamezia-terme:via-del-soccorso:proprieta-disabitata:recovery",
      "basis_source_key": "press:lametino:2015-10-28:falsa-bomba-via-del-soccorso",
      "role": "recovery",
      "municipality": "Lamezia Terme",
      "evidence_basis": "source_stated_street",
      "evidence_precision": "street_segment",
      "resolved_precision": "street_segment",
      "sensitivity": "private_or_sensitive",
      "publication_risk": "residential",
      "geometry": null,
      "place_name": "Vicino al cancello di una proprietà disabitata in via del Soccorso, nei pressi del centro storico",
      "neighbourhood": null,
      "iccs_location_type": null
    }
  ]
}
